[
  {
    "id": "ending-s-truth-and-dawn",
    "grade": "S",
    "threshold": 12,
    "narrative": "當最後一道閃電把祭壇劈成焦黑的碎片，你們扶著那位幾乎斷氣的倖存者踏上泥濘的回程。暴風雨仍在洋房上空盤旋，但那道觸手再也伸不出地縫。你在日記的最後一頁寫下：『洋房的秘密不是被埋葬的 —— 而是被理解後，才終於得以安息。』村子裡迎接你們的是第一縷晨光。沒有人鼓掌，沒有人歡呼，但每個倖存下來的人都知道：你們帶回了真相，也帶回了彼此。"
  },
  {
    "id": "ending-a-heavy-escape",
    "grade": "A",
    "threshold": 8,
    "narrative": "你們衝出洋房大門時，身後的屋瓦正一片片落下。倖存者靠在你肩上微弱地呼吸，背包裡那本禁忌典籍還在發燙。你們揭開了洋房的真相，帶走了足夠讓警察與神職人員動身的證據，但代價並不輕 —— 有人留下了抹不掉的陰影，有人再也不願閉上眼睛。等雨停的那幾天，你常常在睡夢中聽見那聲搖籃曲。"
  },
  {
    "id": "ending-b-incomplete-truth",
    "grade": "B",
    "threshold": 4,
    "narrative": "你們活著走出來了，這已是勝利 —— 即使洋房深處的某些東西，始終沒有被真正回答。倖存者被救出，卻語無倫次；你們帶回了幾件殘破的器物與半本日記，但真相的輪廓仍模糊。村民低聲說，暴風雨過後還是別太晚回家。你望向洋房的方向，知道它還在那裡，耐心地等下一批訪客。"
  },
  {
    "id": "ending-c-barely-alive",
    "grade": "C",
    "threshold": 0,
    "narrative": "暴風雨結束時，只剩下你們幾個人走在泥濘的山路上。洋房沒有揭開它的秘密，倖存者在你們抵達前就已斷氣；你們甚至懷疑，真正從洋房走出來的，是不是完整的自己。夜裡翻開那幾頁抄來的符文，指節還是會不由自主地顫。你不再回頭看那棟屋子，因為你害怕 —— 它可能也正看著你。"
  }
]
